description,category_a,category_b,category_c,category_d,category,description_clean,category_target
單號1700118030收料後卻沒在信箱中收到驗收單，但上MRO首頁有看到驗收流程跑到自己，點進去只是單據內容無法簽核，因此砍單想重送，沒想到砍單後就無法再做收料動作。,BPM平台系統,採購類相關服務,驗收申請單,系統無法登入,BPM平台系統,單號收料後卻沒在信箱中收到驗收單 但上MRO首頁有看到驗收流程跑到 點進去單據內容無法簽核 砍單想重送 沒想到砍單後就無法再做收料動作,0
系統操作出現錯誤訊息  #12317,BPM平台系統,採購類相關服務,驗收申請單,關卡流程詢問,BPM平台系統,系統操作出現錯誤訊息,0
使用者反應已經抽單，但系統上還看到單子停留在尚未處理,BPM平台系統,採購類相關服務,驗收申請單,關卡流程詢問,BPM平台系統,已經抽單 但系統上還看到單子停留在尚未,0
"您好,下午收到一台電腦,在收發室取完電腦後. 回座位發現信箱有一封驗收申請單,因為發現填寫了驗收方式原因,以及會簽人員後,會跳出select視窗要我選bar code. 因操作不慎,按到了抽單.想請問一下,接下來我需要如何重新將這張單子跑回原本流程.單子內容如下：  驗收申請單(GWF112)  ‧表單主旨(Process Purpose)：驗收申請單--個人電腦*1台  ‧表單單號(Process Number)：QCI - APP0546353  ‧申請者(Applicant)：林川評(10407037)  ‧申請時間(Apply Time)：2015/8/12 下午 04:59:26  可以請您幫忙一下嘛？謝謝.",BPM平台系統,採購類相關服務,驗收申請單,關卡流程詢問,BPM平台系統,下午收到一臺電腦 在收發室取完電腦後. 回座位發現信箱有一封驗收申請單 發現填寫了驗收方式原因 會簽人員後 會跳出select視窗要我選bar code. 因操作不慎 按到了抽單.想 我需要重新將這張單子跑回原本流程.單子內容   驗收申請單 GWF112   ‧表單主旨 Process Purpose  驗收申請單  電腦 1台  ‧表號 Process Number  QCI   APP53  ‧申請者 Applicant  林川評    ‧申請時間 Apply Time  2015/8/12 下午 04 59 26  可以請您幫忙一下嘛,0
"mail收到簽核通知, 點下去之後系統提示要先維護二維條碼. 可是不知道要去哪邊維護這項資訊",BPM平台系統,採購類相關服務,驗收申請單,關卡流程詢問,BPM平台系統,mail收到簽核通知  點下去之後系統提示要先維護二維條碼. 不知道要去維護這項資訊,0
我的店鬧無發連網  #990106800  我是測有線網路,內部資訊系統,總務資訊系統,電腦相關服務,電腦申請詢問,內部資訊系統,我的店鬧無發連網     我是測有線網路,3
電腦外帶攜出單無法列印，請協助，謝謝!!,內部資訊系統,總務資訊系統,電腦相關服務,電腦攜出入申請詢問,內部資訊系統,電腦外帶攜出單無法列印 請協助,3
"資產編號990120171被系統判定不存在,導致我無法申請電腦外帶.",內部資訊系統,總務資訊系統,電腦相關服務,電腦申請詢問,內部資訊系統,資產編號被系統判定不存在 導致我無法申請電腦外帶,3
"QSIT 在 指派測試人員的時候, 需要花大量的時間, 去尋找對應人員,   請問是否能多加入按照中文/英文名字去排序的功能? 這樣可以較快的去找到對應的人員  感謝~",R&D資訊系統,測試相關服務,【QSIT】系統整合測試系統,相關操作詢問,R&D資訊系統,QSIT 在 指派測試人員的  需要花大量的時間  去尋找對應人員    請問是否能多加入中文/英文名字去排序的功能  可以較快的去找到對應的人員,1
PDM系統有問題，無法填單,R&D資訊系統,製造相關服務,【BMS】ODM/EMS BOM自動化管理系統,系統無法登入,R&D資訊系統,PDM系統有問題 無法填單,1
早上到現在卡了1個小時了，已經嚴重影響到作業進度。,R&D資訊系統,設計相關服務,【Windchill】共用零件庫及Pro/E圖檔管理系統,無法check in/check out,R&D資訊系統,早上到現在卡了1個小時了 已經嚴重影響到作業進度,1
"忘記PLM密碼, 無法登入",R&D資訊系統,設計相關服務,【Windchill】共用零件庫及Pro/E圖檔管理系統,相關操作詢問,R&D資訊系統,忘記PLM密碼  無法登入,1
已離職同事在PLM上申請的項目無法完成，想要取消重新申請，要如何處理。#17299,R&D資訊系統,設計相關服務,【Windchill】共用零件庫及Pro/E圖檔管理系統,相關操作詢問,R&D資訊系統,已離職同事在PLM上申請的項目無法完成 取消重新申請 要,1
Be able to save CAD in workspace of windchill but cannot check in CAD into client''s winchill in cuppertino  error describtion: There is no Cache designates vault or active folder for Cache designated vault on Lacal Main site,R&D資訊系統,設計相關服務,【Windchill】共用零件庫及Pro/E圖檔管理系統,無法check in/check out,R&D資訊系統,Be able to save CAD in workspace of windcll but cannot check in CAD into client''s wincll in cuppertino  error describtion  There is no Cache designates vault or active folder for Cache designated vault on Lacal Main site,1
user有PLM 使用上問題  #13316,R&D資訊系統,設計相關服務,【Windchill】共用零件庫及Pro/E圖檔管理系統,相關操作詢問,R&D資訊系統,有PLM 使用上問題,1
上海廠內無法開啟myquick網頁,內部資訊系統,QUICK,QUICK 首頁,無法開啟網頁,內部資訊系統,廠內無法開啟myquick網頁,3
電腦外帶時發現資產並不是掛在自己的工號下，無法申請電腦外帶 #18405,內部資訊系統,總務資訊系統,電腦相關服務,電腦外帶證詢問,內部資訊系統,電腦外帶時發現資產並掛在的下 無法申請電腦外帶,3
I accidentally deleted the default windows certificate within my laptop. Would it be a problem to the system? Please help! Thank you! :),內部資訊系統,總務資訊系統,電腦相關服務,電腦資產保管人詢問,內部資訊系統,I accidentally deleted the default windows certificate witn my laptop. Would it be a problem to the system  Please help  Thank you,3
申請者畫面無法正確顯示(連線至)公司內部某些WEB系統畫面。,內部資訊系統,總務資訊系統,電腦相關服務,電腦申請詢問,內部資訊系統,申請者畫面無法正確顯示 連線至 公司內部WEB系統畫面,3
今天白天(12/8)開始，同仁要將電腦攜出，警衛室刷同仁電腦，都會出現外帶證作廢的訊息  ext:10555,內部資訊系統,總務資訊系統,電腦相關服務,電腦外帶證詢問,內部資訊系統,白天 12/8  同仁要將電腦攜出 警衛室刷同仁電腦 都會出現外帶證作廢的訊息,3
二樓警衛刷資產攜出的電腦無法連接server。#10503,內部資訊系統,總務資訊系統,電腦相關服務,電腦攜出入申請詢問,內部資訊系統,二樓警衛刷資產攜出的電腦無法連接server,3
"會議室預約系統,  按下預約按鈕後無反應",內部資訊系統,總務資訊系統,會議室相關服務,相關操作詢問,內部資訊系統,會議室預約系統   按下預約按鈕後無反應,3
#12994  原本預約的會議室不見了。,內部資訊系統,總務資訊系統,會議室相關服務,相關操作詢問,內部資訊系統,原本預約的會議室不見了,3
無法登入系統，所以無法申請交通車。其他同事可正常連線。（已嘗試重新開機）,內部資訊系統,總務資訊系統,交通車相關服務,系統無法登入,內部資訊系統,無法登入系統 無法申請交通車 同事可正常連線  已嘗試重新開機,3
同仁無法登錄此系統http://meetingroom.rsquanta.com/MeetingRoom/50661585-3CF6-4814-A8AC-D56239774926  可否協助確認原因  謝謝~,內部資訊系統,總務資訊系統,會議室相關服務,系統無法登入,內部資訊系統,同仁無法登錄此系統  可否原因,3
會議室系統顯示伺服器中斷，訪客製證系統顯示網路中斷  分機17236,內部資訊系統,總務資訊系統,會議室相關服務,系統無法登入,內部資訊系統,會議室系統顯示伺服器中斷 訪客製證系統顯示網路中斷,3
交通車無法申請。（其他同事可正常申請）,內部資訊系統,總務資訊系統,交通車相關服務,系統無法登入,內部資訊系統,交通車無法申請  同事可正常申請,3
717會議室無法投影，今天一整天要開會，急件。,內部資訊系統,總務資訊系統,會議室相關服務,相關操作詢問,內部資訊系統,717會議室無法投影 一整天要開會,3
can not access    http://qcibpm/GAMS/,內部資訊系統,總務資訊系統,會議室相關服務,系統無法登入,內部資訊系統,can not access,3
使用者反映雲端會議室預約系統有問題，借用資訊與原本申請的不符，原本不須簽核的確收到簽核信件,內部資訊系統,總務資訊系統,會議室相關服務,相關操作詢問,內部資訊系統,反映雲端會議室預約系統有問題 借用資訊與原本申請的不符 原本不須簽核收到簽核信件,3
需要訂會議室但是發現無法登入到總務資訊系統,內部資訊系統,總務資訊系統,會議室相關服務,系統無法登入,內部資訊系統,需要訂會議室發現無法登入到總務資訊系統,3
預約186會議室 15:00 - 17:00，由於面談人員先預約以至於被取消，需將預約狀態修正。  分機：18421,內部資訊系統,總務資訊系統,會議室相關服務,相關操作詢問,內部資訊系統,預約186會議室 15 00   17 00 面談人員先預約被取消 需將預約狀態修正,3
"當要進入預約會議室頁面時發生下面訊息,      ''/GAMS'' 應用程式中發生伺服器錯誤。  --------------------------------------------------------------------------------    並未將物件參考設定為物件的執行個體   描述: 在執行目前 Web 要求的過程中發生未處理的例外情形。請檢閱堆疊追蹤以取得錯誤的詳細資訊，以及在程式碼中產生的位置。     例外詳細資訊: System.NullReferenceException: 並未將物件參考設定為物件的執行個體    原始程式錯誤:       行 598:     arrSign = (ArrayList)Session[""arrSign""];  行 599:     行 600:     if(arrSign[this.ddlConferenceRoom.SelectedIndex].ToString() == ""Y"")  行 601:     {  行 602:      this.lblSignNotice.Visible = true;       原始程式檔: c:\inetpub\wwwroot\GAMS\Program\GAMS_CR\GAMS_CR_SelectOneFreeTime.aspx.cs    行: 600     堆疊追蹤:       [NullReferenceException: 並未將物件參考設定為物件的執行個體]     GAMS_CR.Program.GAMS_CR.GAMS_CR_SelectOneFreeTime.lblCheckSign() in c:\inetpub\wwwroot\GAMS\Program\GAMS_CR\GAMS_CR_SelectOneFreeTime.aspx.cs:600     GAMS_CR.Program.GAMS_CR.GAMS_CR_SelectOneFreeTime.ddlConferenceRoom_SelectedIndexChanged(Object sender, EventArgs e) in c:\inetpub\wwwroot\GAMS\Program\GAMS_CR\GAMS_CR_SelectOneFreeTime.aspx.cs:587     System.Web.UI.WebControls.ListControl.OnSelectedIndexChanged(EventArgs e) +107     System.Web.UI.WebControls.DropDownList.RaisePostDataChangedEvent() +134     System.Web.UI.WebControls.DropDownList.System.Web.UI.IPostBackDataHandler.RaisePostDataChangedEvent() +10     System.Web.UI.Page.RaiseChangedEvents() +165     System.Web.UI.Page.ProcessRequestMain(Boolean includeStagesBeforeAsyncPoint, Boolean includeStagesAfterAsyncPoint) +3135           --------------------------------------------------------------------------------  版本資訊: Microsoft .NET Framework 版本:2.0.50727.6387; ASP.NET 版本:2.0.50727.6427",內部資訊系統,總務資訊系統,會議室相關服務,系統無法登入,內部資訊系統,當要進入預約會議室頁面時發生下麵訊息       ''/GAMS'' 應用程式中發生伺服器錯誤                                                                                       並未將物件參考設定為物件的執行個體   描述  在執行目前 Web 要求的過程中發生未的例外情形 請檢閱堆疊追蹤以取得錯誤的詳細資訊 在程式碼中產生的位置      例外詳細資訊  System.NullReferenceException  並未將物件參考設定為物件的執行個體    原始程式錯誤        行 598      arrSign    ArrayList Session  arrSign     行 599      行 600      if arrSign ts.ddlConferenceRoom.SelectedIndex .ToString       Y    行 601         行 602       ts.lblSignNotice.Visible   true        原始程式檔  c \inetpub\wwwroot\GAMS\Program\GAMS_CR\GAMS_CR_SelectOneFreeTime.aspx.cs    行  600     堆疊追蹤         NullReferenceException  並未將物件參考設定為物件的執行個體      GAMS_CR.Program.GAMS_CR.GAMS_CR_SelectOneFreeTime.lblCheckSign   in c \inetpub\wwwroot\GAMS\Program\GAMS_CR\GAMS_CR_SelectOneFreeTime.aspx.cs 600     GAMS_CR.Program.GAMS_CR.GAMS_CR_SelectOneFreeTime.ddlConferenceRoom_SelectedIndexChanged Object sender  EventArgs e  in c \inetpub\wwwroot\GAMS\Program\GAMS_CR\GAMS_CR_SelectOneFreeTime.aspx.cs 587     System.Web.UI.WebControls.ListControl.OnSelectedIndexChanged EventArgs e   107     System.Web.UI.WebControls.DropDownList.RaisePostDataChangedEvent    134     System.Web.UI.WebControls.DropDownList.System.Web.UI.IPostBackDataHandler.RaisePostDataChangedEvent    10     System.Web.UI.Page.RaiseChangedEvents    165     System.Web.UI.Page.ProcessRequestMain Boolean includeStagesBeforeAsyncPoint  Boolean includeStagesAfterAsyncPoint   3135                                                                                             版本資訊  Microsoft .NET Framework 版本 2.0..6  ASP.NET 版本 2.0..6427,3
Concept與Orcad無法取得Linence與正常開啟,R&D資訊系統,設計相關服務,【Design Tool】Pro/E、OrCAD設計工具管理,相關操作詢問,R&D資訊系統,Concept與Orcad無法取得Linence與正常開啟,1
想要詢問sharepoint使用方式,R&D資訊系統,設計相關服務,【Design Tool】Pro/E、OrCAD設計工具管理,相關操作詢問,R&D資訊系統,詢問sharepoint使用方式,1
OrCAD 找不到license 執行後跳成Lite 版,R&D資訊系統,設計相關服務,【Design Tool】Pro/E、OrCAD設計工具管理,無法取得License,R&D資訊系統,OrCAD 找不到license 執行後跳成Lite 版,1
申請者的表單已經通過簽核，但是並沒有生效。,BPM平台系統,採購類相關服務,Special plant,關卡流程詢問,BPM平台系統,申請者的表單已經簽核 生效,0
新增機器如果沒有選department機器還是可以建，但是在機器清單會看不到機器，重建又會重覆SN,R&D資訊系統,測試相關服務,【測試管理平台】整合測試系統,系統資料異常問題,R&D資訊系統,新增機器沒有選department機器可以建 在機器清單會看不到機器 重建又會重覆SN,1
"系統出現500錯誤,重試IE重開都無效,請協助處理",BPM平台系統,業務類相關服務,Customer Data,關卡流程詢問,BPM平台系統,系統出現500錯誤 重試IE重開都無效,0
南棟警衛反應無法使用，分機10555,BPM平台系統,事務類相關服務,電腦外帶證申請單,系統無法登入,BPM平台系統,南棟警衛反應無法使用,0
"未帶出申請者資產編號, 無法申請.",BPM平台系統,事務類相關服務,電腦外帶證申請單,相關操作詢問,BPM平台系統,未帶出申請者資產編號  無法申請,0
QCI 人員到QSMC 出差時，QSMC 警衛的資產管理系統無法直接刷barcode檢查QCI 人員的電腦登記，以至於需手動開機登記CPU/RAM/HDD/等 訊息。經常遭遇不便，尤其是上下班時刻。曾當面報告方副總此項問題，請求協助處理。    煩請告知處理情形，謝謝。,BPM平台系統,事務類相關服務,電腦外帶證申請單,相關操作詢問,BPM平台系統,QCI 人員到 出差時  警衛的資產管理系統無法直接刷barcode檢查QCI 人員的電腦登記 需手動開機登記CPU/RAM/HDD/等 訊息 遭遇不便 尤其是班時刻 曾當面報告方此項問題 請求     告知情形,0
19999問題單 APP0052388 沒有解決問題。    QCI 人員到QSMC 出差時，QSMC F1 警衛室電腦上的資產管理系統無法直接刷barcode檢查QCI 人員的電腦外出登記，以至於需手動開機登記CPU/RAM/HDD/等 訊息。因此經常遭遇不便，尤其是上下班時刻，耗時費力排隊等待，相當不便。曾當面報告方副總此項問題。 後來申請19999問題單APP0052388，請求協助處理。    現在2014/11/6到QSMC F1出差，警衛室的電腦還是無法讀取出差人員的資產編號卡，只好手動登記機器的細目，連駐廠警衛都覺得很不方便，煩請檢查警衛室電腦上的應用APP是否安裝正確，或是與我聯繫討論，謝謝。,BPM平台系統,事務類相關服務,電腦外帶證申請單,系統無法登入,BPM平台系統,問題單 APP88 沒有     QCI 人員到 出差時  F1 警衛室電腦上的資產管理系統無法直接刷barcode檢查QCI 人員的電腦外出登記 需手動開機登記CPU/RAM/HDD/等 訊息 遭遇不便 尤其是班時刻 耗時費力排隊等待 相當不便 曾當面報告方此項問題  申請問題單APP88 請求     現在2014/11/6到 F1出差 警衛室的電腦無法讀取出差人員的資產編號卡 只好手動登記機器的細目 連駐廠警衛都很不方便 檢查警衛室電腦上的應用APP是否安裝正確 與我聯繫討論,0
申請外帶證無法挑選資產編號,BPM平台系統,事務類相關服務,電腦外帶證申請單,相關操作詢問,BPM平台系統,申請外帶證無法挑選資產編號,0
1.開啟outlook讀取薪資單時，認證不過  2.利用USB網卡連接公司網路時，認證失敗,內部資訊系統,人資資訊系統,薪資相關服務,薪資單郵件無法開啟,人資資訊系統,1.開啟outlook讀取薪資單時 認證  2.利用USB網卡連接公司網路時 認證失敗,2
無法開啟薪資郵件 也有跟人資要過最新的薪資修補程式 但是還是無法開啟    錯誤訊息如下:  您已收到限制權限的郵件。  請開啟此項目以讀取其內容。  -  -  如果您執行的電子郵件應用程式不支援限制權限的郵件 (例如 Microsoft Office 2003 或更新版本)，可以從 http://officeredir.microsoft.com/r/rlidRestrictedPermissionViewer?clid=1028&ver=14&app=outlook.exe&lidhelp=0404&liduser=0404&lidui=0404 下載適用於 Internet Explorer 的版權管理附加元件，以檢視此郵件,內部資訊系統,人資資訊系統,薪資相關服務,薪資單郵件無法開啟,人資資訊系統,無法開啟薪資郵件 也有跟人資要過最新的薪資修補程式 無法開啟    錯誤訊息   您已收到限制權限的郵件   請開啟此項目以讀取其內容         您執行的電子郵件應用程式不支援限制權限的郵件   Microsoft Office 2003 或更新版本  可以從  下載適用於 Internet Explorer 的版權管理附加元件 以檢視此郵件,2
一打開薪資郵件  OUT LOOK 就當機了,內部資訊系統,人資資訊系統,薪資相關服務,薪資單郵件無法開啟,人資資訊系統,一打開薪資郵件  OUT LOOK 就當機了,2
開啟調薪系統後，新頁無法開啟自動關閉。但使用另一台舊有電腦無此狀況。  分機：13079,內部資訊系統,人資資訊系統,薪資相關服務,系統操作問題,人資資訊系統,開啟調薪系統後 新頁無法開啟自動關閉 但使用另一臺舊有電腦無此狀況,2
"點選""電腦申請單""出現錯誤畫面 #16772",BPM平台系統,資訊類相關服務,電腦申請單,系統無法登入,BPM平台系統,點選 電腦申請單 出現錯誤畫面,0
"APP0017224無法抽單,請協助抽單",BPM平台系統,資訊類相關服務,電腦申請單,相關操作詢問,BPM平台系統,APP24無法抽單 請協助抽單,0
操作電腦四年舊換新時出現錯誤訊息，該資產編號名下無保管人，無法繼續操作申請  #16060,BPM平台系統,資訊類相關服務,電腦申請單,相關操作詢問,BPM平台系統,操作電腦四年舊換新時出現錯誤訊息 該資產編號名下無人 無法繼續操作申請,0
"目前在進行申請vendor vode的流程, 廠商在上傳自評時, 在”維護廠商基本資料”的按鈕操作有問題, 按了沒有反應, 也沒有跳出任何頁面.  已有換過兩台電腦, 並且用過IE以及Chrome兩種瀏覽器, 都沒有辦法  還請提供協助, 謝謝",BPM平台系統,品保類相關服務,廠商稽核系統,相關操作詢問,BPM平台系統,目前在進行申請vendor vode的流程  廠商在上傳自評時  在”維護廠商資料”的按鈕操作有問題  按了沒有反應  也沒有跳出頁面.  已有換過兩台電腦  用過IEChrome兩種瀏覽器  都沒有辦法  還請提供協助,0
請幫忙抽單，APP0017668，17741,BPM平台系統,資訊類相關服務,電腦申請單,相關操作詢問,BPM平台系統,請幫忙抽單 APP68,0
填寫完送出時整個當掉,BPM平台系統,資訊類相關服務,電腦申請單,相關操作詢問,BPM平台系統,填寫完送出時整個當掉,0
因重複填寫請協助將電腦申請單app0018183抽單~謝謝,BPM平台系統,資訊類相關服務,電腦申請單,相關操作詢問,BPM平台系統,因重複填寫請協助將電腦申請單app83抽單,0
"如何申請測試用的治具電腦, 並有特殊的規格需求?",BPM平台系統,資訊類相關服務,電腦申請單,相關操作詢問,BPM平台系統,申請測試用的治具電腦  並有特殊的規格需求,0
舊資產已減損，但仍顯示在系統中，無法申請新電腦,BPM平台系統,資訊類相關服務,電腦申請單,關卡流程詢問,BPM平台系統,舊資產已減損 但仍顯示在系統中 無法申請新電腦,0
"http://myquick/顯示""Internet Explorer 無法顯示網頁""，請協助處理，今天有必要作業需要完成。",內部資訊系統,QUICK,QUICK 首頁,無法開啟網頁,內部資訊系統,Explorer 無法顯示網頁   有必要作業需要完成,3
Myquanta首頁打不開，19999接不完,內部資訊系統,QUICK,QUICK 首頁,無法開啟網頁,內部資訊系統,Myquanta首頁打不開 接不完,3
無法連線取得薪資訊息顯示,內部資訊系統,人資資訊系統,薪資相關服務,薪資單郵件無法開啟,人資資訊系統,無法連線取得薪資訊息顯示,2
"Outlook開啟薪資明細時會出現下面的訊息  ""此內容無法透過您目前的認證進行存取。您要使用Microsoft 帳戶來存取此內容嗎?""  如果按是會出現  ""已取消瀏覽該網頁""的網頁  按否則會出現下面的訊息  ""嘗試連線到Active Directory Rights Management Services 伺服器時發生錯誤。請稍後再試或聯絡您的系統管理員""",內部資訊系統,人資資訊系統,薪資相關服務,薪資單郵件無法開啟,人資資訊系統,Outlook開啟薪資明細時會出現下麵的訊息   此內容無法透過您目前的認證進行存取 您要使用Microsoft 帳戶來存取此內容嗎    按是會出現   已取消瀏覽該網頁 的網頁  按會出現下麵的訊息   嘗試連線到Active Directory Rights Management Services 伺服器時發生錯誤 請稍後再試或您的系統管理員,2
這封郵件含有限制的權限，在您確認憑證之前無法在讀取窗格中檢視郵件。請開啟項目，已讀取內容並確認您的憑證。  此內容無法透過您目前的認證進行存取。您要使用Microsft帳戶來存取此內容嗎?,內部資訊系統,人資資訊系統,薪資相關服務,薪資單郵件無法開啟,人資資訊系統,這封郵件含有限制的權限 在您憑證之前無法在讀取窗格中檢視郵件 請開啟項目 已讀取內容您的憑證   此內容無法透過您目前的認證進行存取 您要使用Microsft帳戶來存取此內容嗎,2
近2個月薪資單郵件都無法開啟。,內部資訊系統,人資資訊系統,薪資相關服務,薪資單郵件無法開啟,人資資訊系統,近2個月薪資單郵件都無法開啟,2
無法開啟有權限的信件,內部資訊系統,人資資訊系統,薪資相關服務,薪資單郵件無法開啟,人資資訊系統,無法開啟有權限的信件,2
薪資明細單無法開啟，會發生錯誤。 分機 #11543,內部資訊系統,人資資訊系統,薪資相關服務,薪資單郵件無法開啟,人資資訊系統,薪資明細單無法開啟 會發生錯誤,2
"固定資產減損單單號：APP0014849,我主管已經簽核完,NB也還給MIS,為何還有一人一機電腦使用宣導通知?檢查我的資產還在我帳上,可以幫忙處理一下嗎?謝謝",BPM平台系統,事務類相關服務,固定資產減損申請單,相關操作詢問,BPM平台系統,固定資產減損號 APP49 我已經簽核完 NB也還給MIS 一人一機電腦使用宣導通知 檢查我的資產還在我帳上 可以一下嗎,0
分機: 16389  問題: 表單流程有誤，主管簽核帶錯人員，請協助修正。,BPM平台系統,事務類相關服務,固定資產減損申請單,關卡流程詢問,BPM平台系統,表單流程有誤 簽核帶錯人員 請協助修正,0
桌上型電腦年限久遠不堪使用，欲報廢處理。,BPM平台系統,事務類相關服務,固定資產減損申請單,關卡流程詢問,BPM平台系統,桌上型電腦年限久遠不堪使用 欲報廢,0
資料填錯，單號為APP0010805，因為沒有權限可以抽單，所以麻煩相關人員幫忙抽單 #15360,BPM平台系統,事務類相關服務,固定資產減損申請單,相關操作詢問,BPM平台系統,資料填錯 單號為APP05 沒有權限可以抽單 相關人員幫忙抽單,0
